{
  "blueprint_id": "01J2ZK3AC9V6XW8YQ4R5T6U7ZB",
  "created_at": "2026-07-21T08:00:00Z",
  "id": "01J2ZK3AC9V6XW8YQ4R5T6U7ZC",
  "rationale": "跨平台热度上升且现有内容缺少实测成本角度",
  "schema_version": "1",
  "source_asset_ids": [
    "01J2ZK3AC9V6XW8YQ4R5T6U7W1"
  ],
  "target_language": "zh-CN",
  "target_platform": "douyin",
  "trend_cluster_id": "01J2ZK3AC9V6XW8YQ4R5T6U7X2",
  "vertical": "ai-tech"
}
